<?xml version="1.0" encoding="UTF-8"?>
<blacklist xmlns="http://iaik.tugraz.at/CryptoSlice"
    xmlns:xsi="http://www.w3.org/2001/XMLSchema-instance"
    xsi:schemaLocation="http://iaik.tugraz.at/Cryptoslice schema/blacklist.xsd">
  <exclude path-fragment="/amazonaws/" />
  <exclude path-fragment="/android/support/" />
  <exclude path-fragment="/apache/commons/" />
  <exclude path-fragment="/apache/http/" />
  <exclude path-fragment="/apache/james/"/>
  <exclude path-fragment="/apache/poi/"/>
  <exclude path-fragment="/bownzycastle/" />
  <exclude path-fragment="/boye/httpclientandroidlib/" />
  <exclude path-fragment="/ch/qos/logback/" />
  <exclude path-fragment="/com/actionbarsherlock/" />
  <exclude path-fragment="/com/android/volley/" />
  <exclude path-fragment="/com/caverock/androidsvg/" />
  <exclude path-fragment="/COM/claymoresystems/" />
  <exclude path-fragment="/com/coremedia/iso/" />
  <exclude path-fragment="/com/couchbase/lite" />
  <exclude path-fragment="/com/crashlytics/" />
  <exclude path-fragment="/com/fasterxml/jackson/" />
  <exclude path-fragment="/com/googlecode/mp4parser/" />
  <exclude path-fragment="/com/jcraft/jzlib/" />
  <exclude path-fragment="/com/loopj/android/http/" />
  <exclude path-fragment="/com/microblink/" />
  <exclude path-fragment="/com/ning/http/" />
  <exclude path-fragment="/com/qoppa/" />
  <exclude path-fragment="/com/squareup/okhttp/" />
  <exclude path-fragment="/com/squareup/picasso/" />
  <exclude path-fragment="/com/squareup/timessquare/" />
  <exclude path-fragment="/com/sun/mail/" />
  <exclude path-fragment="/com/viewpagerindicator/" />
  <exclude path-fragment="/crashlytics/android/" />
  <exclude path-fragment="/crittercism/android/" />
  <exclude path-fragment="/cryptix/" />
  <exclude path-fragment="/fr/pcsoft/wdjava/" /><!-- prone to provoke endless loops -->
  <exclude path-fragment="/google/android/gms/" />
  <exclude path-fragment="/google/ads/" />
  <exclude path-fragment="/google/api/" />
  <exclude path-fragment="/io/fabric/sdk/" />
  <exclude path-fragment="/jcfis/http/" />
  <exclude path-fragment="/net/hockeyapp/" />
  <exclude path-fragment="/net/sqlcipher/" />
  <exclude path-fragment="/openfeint/" />
  <exclude path-fragment="/org/acra/" />
  <exclude path-fragment="/org/apache/commons/" />
  <exclude path-fragment="/org/apache/cordova/" />
  <exclude path-fragment="/org/apache/harmony/" />
  <exclude path-fragment="/org/apache/james/" />
  <exclude path-fragment="/org/apache/qpid/" />
  <exclude path-fragment="/org/appcelerator/" />
  <exclude path-fragment="/org/bouncycastle/asn1/" />
  <exclude path-fragment="/org/bouncycastle/crypto/" />
  <exclude path-fragment="/org/bouncycastle/jcajce/" />
  <exclude path-fragment="/org/bouncycastle/jce/" />
  <exclude path-fragment="/org/bouncycastle/math/" />
  <exclude path-fragment="/org/bouncycastle/openssl/" />
  <exclude path-fragment="/org/bouncycastle/pqc/" />
  <exclude path-fragment="/org/bouncycastle/util/" />
  <exclude path-fragment="/org/bouncycastle/x509/" />
  <exclude path-fragment="/org/eclipse/jetty/" />
  <exclude path-fragment="/org/jaxen/" />
  <exclude path-fragment="/org/jboss/netty/" />
  <exclude path-fragment="/org/htmlparser/" />
  <exclude path-fragment="/org/mozilla/universalchardet/" />
  <exclude path-fragment="/org/springframework/" />
  <exclude path-fragment="/org/testng/" />
  <exclude path-fragment="/org/tukaani/xz/" />
  <exclude path-fragment="/org/xbill/" />
  <exclude path-fragment="/qoppa/android/" />
  <exclude path-fragment="/senab/photoview/" />
  <exclude path-fragment="/spongycastle/" />
  <exclude path-fragment="/symbouncycastle/" /><!-- used in com.symantec.mobile.idsafe -->
  <exclude path-fragment="/ti/modules/titanium/" />
  <exclude path-fragment="/twitter4j/" />
  <exclude path-fragment="/unity3d/" />
  <exclude path-fragment="/vending/" />
</blacklist>