<?xml version="1.0" encoding="UTF-8"?>
<blacklist xmlns="http://iaik.tugraz.at/CryptoSlice"
    xmlns:xsi="http://www.w3.org/2001/XMLSchema-instance"
    xsi:schemaLocation="http://iaik.tugraz.at/Cryptoslice schema/blacklist.xsd">
	<exclude path-fragment="/admob/" />
	<exclude path-fragment="/google/ads/" />
	<exclude path-fragment="/flurry/" />
	<exclude path-fragment="/analytics/" />
	<exclude path-fragment="/google/analytics/" />
	<exclude path-fragment="/millennialmedia/" />
	<exclude path-fragment="/mobclix/" />
	<exclude path-fragment="/adwhirl/" />
	<exclude path-fragment="/qwapi/" />
	<exclude path-fragment="/youmi/" />
	<exclude path-fragment="/mobfox/" />
	<exclude path-fragment="/zestadz/" />
	<exclude path-fragment="/cauly/" />
	<exclude path-fragment="/inmobi/" />
	<exclude path-fragment="/wooboo/" />
	<exclude path-fragment="/admarvel/" />
	<exclude path-fragment="/smaato/" />
	<exclude path-fragment="/mobclick/" />
	<exclude path-fragment="/nobot/" />
	<exclude path-fragment="/airpush/" />
	<exclude path-fragment="/mdotm/" />
	<exclude path-fragment="/vdopia/" />
	<exclude path-fragment="/wiyun/" />
	<exclude path-fragment="/adhubs/" />
	<exclude path-fragment="/madhouse/" />
	<exclude path-fragment="/pontiflex/" />
	<exclude path-fragment="/innerActive/" />
	<exclude path-fragment="/adview/" />
	<exclude path-fragment="/casee/" />
	<exclude path-fragment="/greystripe/" />
	<exclude path-fragment="/omniture/" />
	<exclude path-fragment="/guohead/" />
	<exclude path-fragment="/mobilead/" />
	<exclude path-fragment="/domob/" />
	<exclude path-fragment="/tapjoy/" />
	<exclude path-fragment="/Adlantis/" />
	<exclude path-fragment="/adagogo/" />
	<exclude path-fragment="/adchina/" />
	<exclude path-fragment="/jumptap/" />
	<exclude path-fragment="/medialets/" />
	<exclude path-fragment="/nowistech/" />
	<exclude path-fragment="/waps/" />
	<exclude path-fragment="/vpon/" />
	<exclude path-fragment="/energysource/" />
	<exclude path-fragment="/iconosys/" />
	<exclude path-fragment="/adwo/" />
	<exclude path-fragment="/sktelecom/" />
	<exclude path-fragment="/uplusad/" />
	<exclude path-fragment="/smartadserver/" />
	<exclude path-fragment="/airad/" />
	<exclude path-fragment="/emome/" />
	<exclude path-fragment="/mopub/" />
	<exclude path-fragment="/adfonic/" />
	<exclude path-fragment="/vdroid/" />
	<exclude path-fragment="/transpera/" />
	<exclude path-fragment="/mobgold/" />
	<exclude path-fragment="/mobus/" />
	<exclude path-fragment="/hutuchong/" />
	<exclude path-fragment="/mads/" />
	<exclude path-fragment="/everbadge/" />
	<exclude path-fragment="/zetacube/" />
	<exclude path-fragment="/smartad/" />
	<exclude path-fragment="/adlib_android/" />
	<exclude path-fragment="/trickersticks/" />
	<exclude path-fragment="/ccmedia/" />
	<exclude path-fragment="/sosceo/" />
	<exclude path-fragment="/Mojiva/" />
	<exclude path-fragment="/admogo/" />
	<exclude path-fragment="/nexage/" />
	<exclude path-fragment="/rhythmnewmedia/" />
	<exclude path-fragment="/mediba/" />
	<exclude path-fragment="/madvertise/" />
	<exclude path-fragment="/qriously/" />
	<exclude path-fragment="/zumobi/" />
	<exclude path-fragment="/netmite/" />
	<exclude path-fragment="/imapp/" />
	<exclude path-fragment="/yicha/" />
	<exclude path-fragment="/oneriot/" />
	<exclude path-fragment="/aduru/" />
	<exclude path-fragment="/admoda/" />
	<exclude path-fragment="/imobile/" />
	<exclude path-fragment="/moblico/" />
	<exclude path-fragment="/linkshare/" />
	<exclude path-fragment="/ignitevision/" />
	<exclude path-fragment="/fractalist/" />
	<exclude path-fragment="/plankton/" />
	<exclude path-fragment="/cellitads/" />
	<exclude path-fragment="/appmedia/" />
	<exclude path-fragment="/glam/" />
	<exclude path-fragment="/adtutu/" />
	<exclude path-fragment="/adfox/" />
	<exclude path-fragment="/netad/" />
	<exclude path-fragment="/freewheel/" />
	<exclude path-fragment="/adinside/" />
	<exclude path-fragment="/taobao/" />
	<exclude path-fragment="/amaze/" />
	<exclude path-fragment="/admozi/" />
	<exclude path-fragment="/wqmobile/" />
	<exclude path-fragment="/ubermind/" />
	<exclude path-fragment="/innoace/" />
	<exclude path-fragment="/adyx/" />
</blacklist>